{
  "entries": [
    {
      "abbreviation": "PET",
      "abbreviation_rule": null,
      "assignment_status": "assigned",
      "composition": [],
      "display_code": "PET 1",
      "disposal_semantics": "none",
      "mark_id": "packaging-material:eu-97-129:1",
      "material_family": "plastic",
      "material_name": "Polietilentereftalato",
      "numeric_code": 1,
      "predominant_family": null,
      "recognition_tokens": [
        "PET",
        "1"
      ]
    },
    {
      "abbreviation": "HDPE",
      "abbreviation_rule": null,
      "assignment_status": "assigned",
      "composition": [],
      "display_code": "HDPE 2",
      "disposal_semantics": "none",
      "mark_id": "packaging-material:eu-97-129:2",
      "material_family": "plastic",
      "material_name": "Polietilene ad alta densita",
      "numeric_code": 2,
      "predominant_family": null,
      "recognition_tokens": [
        "HDPE",
        "2"
      ]
    },
    {
      "abbreviation": "PVC",
      "abbreviation_rule": null,
      "assignment_status": "assigned",
      "composition": [],
      "display_code": "PVC 3",
      "disposal_semantics": "none",
      "mark_id": "packaging-material:eu-97-129:3",
      "material_family": "plastic",
      "material_name": "Cloruro di polivinile",
      "numeric_code": 3,
      "predominant_family": null,
      "recognition_tokens": [
        "PVC",
        "3"
      ]
    },
    {
      "abbreviation": "LDPE",
      "abbreviation_rule": null,
      "assignment_status": "assigned",
      "composition": [],
      "display_code": "LDPE 4",
      "disposal_semantics": "none",
      "mark_id": "packaging-material:eu-97-129:4",
      "material_family": "plastic",
      "material_name": "Polietilene a bassa densita",
      "numeric_code": 4,
      "predominant_family": null,
      "recognition_tokens": [
        "LDPE",
        "4"
      ]
    },
    {
      "abbreviation": "PP",
      "abbreviation_rule": null,
      "assignment_status": "assigned",
      "composition": [],
      "display_code": "PP 5",
      "disposal_semantics": "none",
      "mark_id": "packaging-material:eu-97-129:5",
      "material_family": "plastic",
      "material_name": "Polipropilene",
      "numeric_code": 5,
      "predominant_family": null,
      "recognition_tokens": [
        "PP",
        "5"
      ]
    },
    {
      "abbreviation": "PS",
      "abbreviation_rule": null,
      "assignment_status": "assigned",
      "composition": [],
      "display_code": "PS 6",
      "disposal_semantics": "none",
      "mark_id": "packaging-material:eu-97-129:6",
      "material_family": "plastic",
      "material_name": "Polistirolo",
      "numeric_code": 6,
      "predominant_family": null,
      "recognition_tokens": [
        "PS",
        "6"
      ]
    },
    {
      "abbreviation": null,
      "abbreviation_rule": null,
      "assignment_status": "unassigned",
      "composition": [],
      "display_code": "7",
      "disposal_semantics": "none",
      "mark_id": "packaging-material:eu-97-129:7",
      "material_family": "plastic",
      "material_name": null,
      "numeric_code": 7,
      "predominant_family": null,
      "recognition_tokens": [
        "7"
      ]
    },
    {
      "abbreviation": null,
      "abbreviation_rule": null,
      "assignment_status": "unassigned",
      "composition": [],
      "display_code": "8",
      "disposal_semantics": "none",
      "mark_id": "packaging-material:eu-97-129:8",
      "material_family": "plastic",
      "material_name": null,
      "numeric_code": 8,
      "predominant_family": null,
      "recognition_tokens": [
        "8"
      ]
    },
    {
      "abbreviation": null,
      "abbreviation_rule": null,
      "assignment_status": "unassigned",
      "composition": [],
      "display_code": "9",
      "disposal_semantics": "none",
      "mark_id": "packaging-material:eu-97-129:9",
      "material_family": "plastic",
      "material_name": null,
      "numeric_code": 9,
      "predominant_family": null,
      "recognition_tokens": [
        "9"
      ]
    },
    {
      "abbreviation": null,
      "abbreviation_rule": null,
      "assignment_status": "unassigned",
      "composition": [],
      "display_code": "10",
      "disposal_semantics": "none",
      "mark_id": "packaging-material:eu-97-129:10",
      "material_family": "plastic",
      "material_name": null,
      "numeric_code": 10,
      "predominant_family": null,
      "recognition_tokens": [
        "10"
      ]
    },
    {
      "abbreviation": null,
      "abbreviation_rule": null,
      "assignment_status": "unassigned",
      "composition": [],
      "display_code": "11",
      "disposal_semantics": "none",
      "mark_id": "packaging-material:eu-97-129:11",
      "material_family": "plastic",
      "material_name": null,
      "numeric_code": 11,
      "predominant_family": null,
      "recognition_tokens": [
        "11"
      ]
    },
    {
      "abbreviation": null,
      "abbreviation_rule": null,
      "assignment_status": "unassigned",
      "composition": [],
      "display_code": "12",
      "disposal_semantics": "none",
      "mark_id": "packaging-material:eu-97-129:12",
      "material_family": "plastic",
      "material_name": null,
      "numeric_code": 12,
      "predominant_family": null,
      "recognition_tokens": [
        "12"
      ]
    },
    {
      "abbreviation": null,
      "abbreviation_rule": null,
      "assignment_status": "unassigned",
      "composition": [],
      "display_code": "13",
      "disposal_semantics": "none",
      "mark_id": "packaging-material:eu-97-129:13",
      "material_family": "plastic",
      "material_name": null,
      "numeric_code": 13,
      "predominant_family": null,
      "recognition_tokens": [
        "13"
      ]
    },
    {
      "abbreviation": null,
      "abbreviation_rule": null,
      "assignment_status": "unassigned",
      "composition": [],
      "display_code": "14",
      "disposal_semantics": "none",
      "mark_id": "packaging-material:eu-97-129:14",
      "material_family": "plastic",
      "material_name": null,
      "numeric_code": 14,
      "predominant_family": null,
      "recognition_tokens": [
        "14"
      ]
    },
    {
      "abbreviation": null,
      "abbreviation_rule": null,
      "assignment_status": "unassigned",
      "composition": [],
      "display_code": "15",
      "disposal_semantics": "none",
      "mark_id": "packaging-material:eu-97-129:15",
      "material_family": "plastic",
      "material_name": null,
      "numeric_code": 15,
      "predominant_family": null,
      "recognition_tokens": [
        "15"
      ]
    },
    {
      "abbreviation": null,
      "abbreviation_rule": null,
      "assignment_status": "unassigned",
      "composition": [],
      "display_code": "16",
      "disposal_semantics": "none",
      "mark_id": "packaging-material:eu-97-129:16",
      "material_family": "plastic",
      "material_name": null,
      "numeric_code": 16,
      "predominant_family": null,
      "recognition_tokens": [
        "16"
      ]
    },
    {
      "abbreviation": null,
      "abbreviation_rule": null,
      "assignment_status": "unassigned",
      "composition": [],
      "display_code": "17",
      "disposal_semantics": "none",
      "mark_id": "packaging-material:eu-97-129:17",
      "material_family": "plastic",
      "material_name": null,
      "numeric_code": 17,
      "predominant_family": null,
      "recognition_tokens": [
        "17"
      ]
    },
    {
      "abbreviation": null,
      "abbreviation_rule": null,
      "assignment_status": "unassigned",
      "composition": [],
      "display_code": "18",
      "disposal_semantics": "none",
      "mark_id": "packaging-material:eu-97-129:18",
      "material_family": "plastic",
      "material_name": null,
      "numeric_code": 18,
      "predominant_family": null,
      "recognition_tokens": [
        "18"
      ]
    },
    {
      "abbreviation": null,
      "abbreviation_rule": null,
      "assignment_status": "unassigned",
      "composition": [],
      "display_code": "19",
      "disposal_semantics": "none",
      "mark_id": "packaging-material:eu-97-129:19",
      "material_family": "plastic",
      "material_name": null,
      "numeric_code": 19,
      "predominant_family": null,
      "recognition_tokens": [
        "19"
      ]
    },
    {
      "abbreviation": "PAP",
      "abbreviation_rule": null,
      "assignment_status": "assigned",
      "composition": [],
      "display_code": "PAP 20",
      "disposal_semantics": "none",
      "mark_id": "packaging-material:eu-97-129:20",
      "material_family": "paper_cardboard",
      "material_name": "Cartone ondulato",
      "numeric_code": 20,
      "predominant_family": null,
      "recognition_tokens": [
        "PAP",
        "20"
      ]
    },
    {
      "abbreviation": "PAP",
      "abbreviation_rule": null,
      "assignment_status": "assigned",
      "composition": [],
      "display_code": "PAP 21",
      "disposal_semantics": "none",
      "mark_id": "packaging-material:eu-97-129:21",
      "material_family": "paper_cardboard",
      "material_name": "Cartone non ondulato",
      "numeric_code": 21,
      "predominant_family": null,
      "recognition_tokens": [
        "PAP",
        "21"
      ]
    },
    {
      "abbreviation": "PAP",
      "abbreviation_rule": null,
      "assignment_status": "assigned",
      "composition": [],
      "display_code": "PAP 22",
      "disposal_semantics": "none",
      "mark_id": "packaging-material:eu-97-129:22",
      "material_family": "paper_cardboard",
      "material_name": "Carta",
      "numeric_code": 22,
      "predominant_family": null,
      "recognition_tokens": [
        "PAP",
        "22"
      ]
    },
    {
      "abbreviation": null,
      "abbreviation_rule": null,
      "assignment_status": "unassigned",
      "composition": [],
      "display_code": "23",